{
  "brief_id": "brief-4924573714cd",
  "content_hash": "f71a61093a8cff695512b8551406c468c621a3bd9ca629b8913b67ffb8e08ab3",
  "content_ref": "/Users/farricecain/Google Antigravity/.tmp/codex-worktrees/search-content-mastery/_active/search-content-mastery/angle-map-search-answer-prototype/proof-to-angle-media-brief.md",
  "created_at": "2026-08-05T15:29:52.597687+00:00",
  "dimensions": {
    "aeo_geo_readiness": {
      "checks": [
        {
          "available_points": 3,
          "evidence": "answer-like language appears in opening",
          "id": "direct_answer",
          "passed": true,
          "points": 3
        },
        {
          "available_points": 2,
          "evidence": "question heading present",
          "id": "question_heading",
          "passed": false,
          "points": 0
        },
        {
          "available_points": 2,
          "evidence": "list or table present",
          "id": "structured_answer",
          "passed": true,
          "points": 2
        },
        {
          "available_points": 1,
          "evidence": "named entity definition",
          "id": "entity_definition",
          "passed": true,
          "points": 1
        },
        {
          "available_points": 2,
          "evidence": "multiple source-support markers",
          "id": "source_support",
          "passed": false,
          "points": 0
        }
      ],
      "combined_score": 6.45,
      "deterministic_score": 6.0,
      "expert_judgment": {
        "notes": "The visual makes the evidence limit visible before the creative payoff and avoids medical-approval symbolism. It remains a brief, not a rendered or comprehension-tested asset, and the fictional receipt must be replaced with client-approved truth in a real delivery.",
        "reviewer": "Codex bounded visual-and-evidence review",
        "score": 7.5,
        "status": "PROVIDED"
      }
    },
    "claim_risk": {
      "checks": [
        {
          "available_points": 4,
          "evidence": "0 guarantee-risk terms",
          "id": "no_guarantees",
          "passed": true,
          "points": 4
        },
        {
          "available_points": 2,
          "evidence": "0 absolute terms",
          "id": "few_absolutes",
          "passed": true,
          "points": 2
        },
        {
          "available_points": 2,
          "evidence": "35 numbers; 1 support markers",
          "id": "numbers_supported",
          "passed": true,
          "points": 2
        },
        {
          "available_points": 2,
          "evidence": "brief boundary or equivalent visible",
          "id": "risk_boundary_visible",
          "passed": true,
          "points": 2
        }
      ],
      "combined_score": 9.55,
      "deterministic_score": 10.0,
      "expert_judgment": {
        "notes": "The visual makes the evidence limit visible before the creative payoff and avoids medical-approval symbolism. It remains a brief, not a rendered or comprehension-tested asset, and the fictional receipt must be replaced with client-approved truth in a real delivery.",
        "reviewer": "Codex bounded visual-and-evidence review",
        "score": 8.5,
        "status": "PROVIDED"
      }
    },
    "conversion_alignment": {
      "checks": [
        {
          "available_points": 5,
          "evidence": "CTA='Send me the live page or campaign. I will point to one consequential message or proof gap using your public words\u2014nothing invented.'",
          "id": "cta_present",
          "passed": true,
          "points": 5
        },
        {
          "available_points": 2,
          "evidence": "CTA is present without obvious repetition",
          "id": "single_next_action",
          "passed": true,
          "points": 2
        },
        {
          "available_points": 2,
          "evidence": "audience language supports CTA",
          "id": "audience_bridge",
          "passed": true,
          "points": 2
        },
        {
          "available_points": 1,
          "evidence": "0 guarantee-risk terms",
          "id": "no_outcome_guarantee",
          "passed": true,
          "points": 1
        }
      ],
      "combined_score": 9.25,
      "deterministic_score": 10.0,
      "expert_judgment": {
        "notes": "The visual makes the evidence limit visible before the creative payoff and avoids medical-approval symbolism. It remains a brief, not a rendered or comprehension-tested asset, and the fictional receipt must be replaced with client-approved truth in a real delivery.",
        "reviewer": "Codex bounded visual-and-evidence review",
        "score": 7.5,
        "status": "PROVIDED"
      }
    },
    "format_fit": {
      "checks": [
        {
          "available_points": 5,
          "evidence": "4/4 channel markers",
          "id": "channel_markers",
          "passed": true,
          "points": 5
        },
        {
          "available_points": 3,
          "evidence": "brief structural pattern appears",
          "id": "structural_pattern",
          "passed": true,
          "points": 3
        },
        {
          "available_points": 2,
          "evidence": "709 words",
          "id": "length_present",
          "passed": true,
          "points": 2
        }
      ],
      "combined_score": 9.55,
      "deterministic_score": 10.0,
      "expert_judgment": {
        "notes": "The visual makes the evidence limit visible before the creative payoff and avoids medical-approval symbolism. It remains a brief, not a rendered or comprehension-tested asset, and the fictional receipt must be replaced with client-approved truth in a real delivery.",
        "reviewer": "Codex bounded visual-and-evidence review",
        "score": 8.5,
        "status": "PROVIDED"
      }
    },
    "human_usefulness": {
      "checks": [
        {
          "available_points": 2,
          "evidence": "709 words",
          "id": "substantive",
          "passed": true,
          "points": 2
        },
        {
          "available_points": 2,
          "evidence": "average sentence length 8.5",
          "id": "readable_sentences",
          "passed": true,
          "points": 2
        },
        {
          "available_points": 2,
          "evidence": "steps or scannable actions",
          "id": "actionable",
          "passed": true,
          "points": 2
        },
        {
          "available_points": 2,
          "evidence": "example or scenario present",
          "id": "example",
          "passed": true,
          "points": 2
        },
        {
          "available_points": 2,
          "evidence": "limitation or caveat visible",
          "id": "limits",
          "passed": true,
          "points": 2
        }
      ],
      "combined_score": 9.55,
      "deterministic_score": 10.0,
      "expert_judgment": {
        "notes": "The visual makes the evidence limit visible before the creative payoff and avoids medical-approval symbolism. It remains a brief, not a rendered or comprehension-tested asset, and the fictional receipt must be replaced with client-approved truth in a real delivery.",
        "reviewer": "Codex bounded visual-and-evidence review",
        "score": 8.5,
        "status": "PROVIDED"
      }
    },
    "information_gain": {
      "checks": [
        {
          "available_points": 3,
          "evidence": "brief information-gain requirement appears verbatim",
          "id": "explicit_gain",
          "passed": true,
          "points": 3
        },
        {
          "available_points": 3,
          "evidence": "original-data, observation, case, or first-hand marker",
          "id": "originality_marker",
          "passed": false,
          "points": 0
        },
        {
          "available_points": 2,
          "evidence": "worked example or scenario marker",
          "id": "worked_example",
          "passed": true,
          "points": 2
        },
        {
          "available_points": 2,
          "evidence": "11 distinct numeric anchors",
          "id": "specificity",
          "passed": true,
          "points": 2
        }
      ],
      "combined_score": 7.45,
      "deterministic_score": 7.0,
      "expert_judgment": {
        "notes": "The visual makes the evidence limit visible before the creative payoff and avoids medical-approval symbolism. It remains a brief, not a rendered or comprehension-tested asset, and the fictional receipt must be replaced with client-approved truth in a real delivery.",
        "reviewer": "Codex bounded visual-and-evidence review",
        "score": 8.5,
        "status": "PROVIDED"
      }
    },
    "intent_fit": {
      "checks": [
        {
          "available_points": 4,
          "evidence": "title='How to Create Supplement Marketing Angles Without Overclaiming: Proof-To-Angle Visual Brief'",
          "id": "query_in_title",
          "passed": true,
          "points": 4
        },
        {
          "available_points": 2,
          "evidence": "7/7 query tokens present",
          "id": "query_token_coverage",
          "passed": true,
          "points": 2
        },
        {
          "available_points": 2,
          "evidence": "3/5 audience tokens present",
          "id": "audience_language",
          "passed": true,
          "points": 2
        },
        {
          "available_points": 2,
          "evidence": "intent=informational",
          "id": "intent_marker",
          "passed": true,
          "points": 2
        }
      ],
      "combined_score": 9.4,
      "deterministic_score": 10.0,
      "expert_judgment": {
        "notes": "The visual makes the evidence limit visible before the creative payoff and avoids medical-approval symbolism. It remains a brief, not a rendered or comprehension-tested asset, and the fictional receipt must be replaced with client-approved truth in a real delivery.",
        "reviewer": "Codex bounded visual-and-evidence review",
        "score": 8.0,
        "status": "PROVIDED"
      }